{
  "$schema": "../governance/make-lint/scenario_rules.schema.json",
  "scenario_id": "PUBLISH_MANIFEST",
  "lint_profile": "audit-only",
  "authority_level": "audit",
  "expected_modules": {
    "state_hash_compare": true,
    "hash_before_export": true,
    "ledger_write": true,
    "slack_post": true
  }
}
